{
  "$schema": "https://json-schema.org/draft/2020-12/schema",
  "title": "STATE.json",
  "type": "object",
  "required": [
    "schema_version",
    "policy",
    "claims"
  ],
  "properties": {
    "schema_version": {
      "const": 1
    },
    "release_status": {
      "type": "string"
    },
    "current_milestone": {
      "type": [
        "string",
        "null"
      ]
    },
    "policy": {
      "type": "object",
      "required": [
        "mode"
      ],
      "properties": {
        "mode": {
          "enum": [
            "gated",
            "fast"
          ]
        },
        "changed_at": {
          "type": [
            "string",
            "null"
          ]
        },
        "reason": {
          "type": [
            "string",
            "null"
          ]
        }
      }
    },
    "release_blockers": {
      "type": "array",
      "items": {
        "type": "string"
      }
    },
    "last_verified_commit": {
      "type": [
        "string",
        "null"
      ]
    },
    "environments": {
      "type": "object"
    },
    "claims": {
      "type": "array",
      "items": {
        "type": "object",
        "required": [
          "issue",
          "agent_id",
          "runtime",
          "branch",
          "claimed_at",
          "lease_until"
        ],
        "properties": {
          "issue": {
            "type": "integer"
          },
          "agent_id": {
            "type": "string"
          },
          "runtime": {
            "type": "string"
          },
          "role": {
            "type": [
              "string",
              "null"
            ]
          },
          "branch": {
            "type": "string"
          },
          "worktree": {
            "type": [
              "string",
              "null"
            ]
          },
          "owned_paths": {
            "type": "array",
            "items": {
              "type": "string"
            }
          },
          "claimed_at": {
            "type": "string",
            "pattern": "^\\d{4}-\\d{2}-\\d{2}T\\d{2}:\\d{2}:\\d{2}Z$"
          },
          "lease_until": {
            "type": "string",
            "pattern": "^\\d{4}-\\d{2}-\\d{2}T\\d{2}:\\d{2}:\\d{2}Z$"
          },
          "heartbeat_at": {
            "type": [
              "string",
              "null"
            ]
          },
          "nonce": {
            "type": "string"
          }
        }
      }
    },
    "owner_decisions": {
      "type": "array"
    },
    "usage_summary": {
      "type": "object"
    }
  }
}
