{
  "schema_version": 1,
  "release_status": "BUILDING",
  "current_milestone": null,
  "policy": { "mode": "gated", "changed_at": null, "reason": null },
  "release_blockers": [],
  "last_verified_commit": null,
  "environments": {},
  "claims": [],
  "owner_decisions": [],
  "usage_summary": { "tier_share": { "T0": 0, "T1": 0, "T2": 0, "T3": 0 }, "as_of": null }
}
